Paper#Ref;Input Modalities > Image;Derived Data > Affective Features;Derived Data > Scene Graphs;Derived Data > Image Features;..> Image Features > Global Image Features;Summarization > Combined Scene Graph;Summarization > Maximum Common Subgraph;Summarization > Ranking;Summarization > Clustering;Summarizing Entities > Captions;Summarizing Entities > Representative Images;Visual Layout > None;Visual Layout > Embedding;Visual Layout > List;Interactions > None;Interactions > Grouping;Interactions > Turning;Interactions > Zooming;Interactions > Selection;Tasks > Annotation;Tasks > Captioning;Tasks > Summarization;Tasks > Interactive Exploration;Set size > <100;Set size > Thousands;Application Area > medical;Evaluation > None;Evaluation > Metrics;..> Metrics > ROGUE;..> Metrics > BLEU;..> Metrics > CIDEr;..> Metrics > BERTScore;Evaluation > User study;
Semantic Hierarchical Exploration of Large Image Datasets#http://zotero.org/groups/3431/items/VS6X3P5L;
DendroMap: Visual Exploration of Large-Scale Image Datasets for Machine Learning with Treemaps#http://zotero.org/groups/3431/items/C9ZFYC3Y;
Image summarization using topic modelling#http://zotero.org/groups/3431/items/DLY3AMJY;
Urban Mosaic: Visual Exploration of Streetscapes Using Large-Scale Image Data#http://zotero.org/groups/3431/items/IVC76KGV;
Joint optimisation convex-negative matrix factorisation for multi-modal image collection summarisation based on images and tags#http://zotero.org/groups/3431/items/89I3KA4T;
Style-centric image summarization from photographic views of a city#http://zotero.org/groups/3431/items/P9MV7J4N;
A viewable indexing structure for the interactive exploration of dynamic and large image collections#http://zotero.org/groups/3431/items/GAB27IWZ;
Tree-Based Visualization and Optimization for Image Collection#http://zotero.org/groups/3431/items/UN3S5BN8;
ARIES: Enabling visual exploration and organization of art image collections#http://zotero.org/groups/3431/items/W32DLE9P;
Visualization and recommendation of large image collections toward effective sensemaking#http://zotero.org/groups/3431/items/7XM9ZI4S;
'Picture the scene...' visually summarising social media events#http://zotero.org/groups/3431/items/FCXZXJ65;
Visualizing document image collections using image-based word clouds#http://zotero.org/groups/3431/items/VJRKY24N;
A summarized photo visualization system with maximal clique finding algorithm#http://zotero.org/groups/3431/items/VUKTFF64;
Combining conceptual query expansion and visual search results exploration for web image retrieval#http://zotero.org/groups/3431/items/7C4LLQEB;
II-20: Intelligent and pragmatic analytic categorization of image collections#http://zotero.org/groups/3431/items/PRYCUTRS;
Narrative Collage of Image Collections by Scene Graph Recombination#http://zotero.org/groups/3431/items/9Q6KU7FV;
Similarity-based visualization of large image collections#http://zotero.org/groups/3431/items/FF2IHK9E;
Content-Based Visual Summarization for Image Collections#http://zotero.org/groups/3431/items/QWPNISL7;
Real-time visual navigation in huge image sets using similarity graphs#http://zotero.org/groups/3431/items/T9UJYMHW;
Generating summaries for photographic images based on human affects#http://zotero.org/groups/3431/items/HJ264SP4;1;1;0;1;0;0;0;1;1;0;1;0;0;1;0;0;0;0;0;0;0;0;0;0;0;0;0;0;0;0;0;0;1;
Ceiba: Scalable visualization of phylogenies and 2D/3D image collections#http://zotero.org/groups/3431/items/4CV8CZXR;
A joint optimization model for image summarization based on image content and tags#http://zotero.org/groups/3431/items/25TPE85J;
ClusterTag: Interactive visualization, clustering and tagging tool for big image collections#http://zotero.org/groups/3431/items/C5YEJ2YL;1;0;0;2;1;0;0;0;1;0;1;0;1;0;0;1;1;1;1;1;0;0;2;0;1;1;1;0;0;0;0;0;0;
PRISM: Concept-preserving social image search results summarization#http://zotero.org/groups/3431/items/IA8E5FHA;
A knowledge-based semantic approach for image collection summarization#http://zotero.org/groups/3431/items/YBP4748U;
An Approach to Generate a Caption for an Image Collection Using Scene Graph Generation#http://zotero.org/groups/3431/items/HPDC5VZ6;1;0;1;1;0;1;1;0;0;1;0;1;0;0;1;0;0;0;0;0;1;1;0;1;0;0;0;1;1;1;1;1;0;
Visualizing multimodal image collections#http://zotero.org/groups/3431/items/V7VMZ3FL;
ICLIC: Interactive categorization of large image collections#http://zotero.org/groups/3431/items/FFCPXZN3;
Data Analysis on Multivariate Image Set#http://zotero.org/groups/3431/items/A7MS2YXS;
Large image collection visualization using perception-based similarity with color features#http://zotero.org/groups/3431/items/RQECLPFX;
PRISM: Concept-preserving summarization of top-k social image search results#http://zotero.org/groups/3431/items/LUJ52FFA;
Method for exploring generative adversarial networks (gans) via automatically generated image galleries#http://zotero.org/groups/3431/items/GQ9EHRIE;
Dataset fingerprints: Exploring image collections through data mining#http://zotero.org/groups/3431/items/JKFJPWSU;
Visual summarization of image collections by fast RANSAC#http://zotero.org/groups/3431/items/ERRZFZW9;
Hybrid image summarization by hypergraph partition#http://zotero.org/groups/3431/items/WTECAIT6;
Multimodal latent topic analysis for image collection summarization#http://zotero.org/groups/3431/items/6N94DJ5E;
Advanced Interface Design for IIIF A Digital Tool to Explore Image Collections at Different Scales#http://zotero.org/groups/3431/items/HKYHHKXN;
Semantic Image Collection Summarization with Frequent Subgraph Mining#http://zotero.org/groups/3431/items/FPGISWWN;
Discovering collective narratives of theme parks from large collections of visitors' Photo streams#http://zotero.org/groups/3431/items/KWGY7JFH;
Personalized representative image selection for shared photo albums#http://zotero.org/groups/3431/items/IMGD8389;
Visual berrypicking in large image collections#http://zotero.org/groups/3431/items/HUI7SATG;
Incremental hierarchical indexing and visualisation of large image collections#http://zotero.org/groups/3431/items/VGRK58VY;
Concept preserving visual summarization of social image search results#http://zotero.org/groups/3431/items/IE2QHFK5;
An Associate-Rule-Aware Multidimensional Data Visualization Technique and Its Application to Painting Image Collections#http://zotero.org/groups/3431/items/4W6QRBLR;
A Semantic-Based Method for Visualizing Large Image Collections#http://zotero.org/groups/3431/items/9V74JR4E;
Combining Semantic and Visual Image Graphs for Efficient Search and Exploration of Large Dynamic Image Collections#http://zotero.org/groups/3431/items/KE3L5ITZ;
IGraph: A graph-based technique for visual analytics of image and text collections#http://zotero.org/groups/3431/items/I6QUTQEM;
Seeing the big picture from microblogs: Harnessing social signals for visual event summarization#http://zotero.org/groups/3431/items/8RTPFWQI;
ConceptLearner: Discovering visual concepts from weakly labeled image collections#http://zotero.org/groups/3431/items/D2X68QQL;
Multimodal-based diversified summarization in social image retrieval#http://zotero.org/groups/3431/items/JMD2ATBC;
APoD eXplorer: Recommendation system and interactive exploration of a dynamic image collection#http://zotero.org/groups/3431/items/5NGWL8Y4;
Towards Captioning an Image Collection from a Combined Scene Graph Representation Approach#http://zotero.org/groups/3431/items/SXEI9VD3;
Motif Mining: Finding and Summarizing Remixed Image Content#http://zotero.org/groups/3431/items/252RZ28U;
Graph navigation for exploring very large image collections#http://zotero.org/groups/3431/items/5BDVQVVJ;
Generating visual story graphs with application to photo album summarization#http://zotero.org/groups/3431/items/CMMBXLJF;
CLAN photo presenter: Multi-modal summarization tool for image collections#http://zotero.org/groups/3431/items/AJ2T49K4;
Interactive browsing of image collections on mobile devices#http://zotero.org/groups/3431/items/ZB3CKS5Y;
Learning crowdsourced user preferences for visual summarization of image collections#http://zotero.org/groups/3431/items/PECZIRJ3;
A novel variety-based 3DTV content generation scheme for casually captured sparse photo collections#http://zotero.org/groups/3431/items/KY7MSQIB;
A kernel-based framework for image collection exploration#http://zotero.org/groups/3431/items/5TRRFRRV;
Generating visual summaries of geographic areas using community-contributed images#http://zotero.org/groups/3431/items/5UHA4898;
Interactive exploration of large photo libraries#http://zotero.org/groups/3431/items/X2L2PXL3;
MICS: Multimodal image collection summarization by optimal reconstruction subset selection#http://zotero.org/groups/3431/items/TK35ZVXV;
Visualization of Photo Album: Selecting a Representative Photo of a Specific Event#http://zotero.org/groups/3431/items/TI8TXURK;
Comparing Personal Image Collections with PICTuReVis#http://zotero.org/groups/3431/items/EEELP2V2;
Story Albums: Creating Fictional Stories From Personal Photograph Sets#http://zotero.org/groups/3431/items/5YR9NTR2;
Album Quickview in Comic-like Layout via Quartet Analysis#http://zotero.org/groups/3431/items/UXVFXIU4;
Visualizing Natural Image Statistics#http://zotero.org/groups/3431/items/KNKIPBGZ;
Image Collage on Arbitrary Shape via Shape-Aware Slicing and Optimization#http://zotero.org/groups/3431/items/P4DWR7LL;
